{
  "schema_version": "1.0.0",
  "run_id": "20241120-103000-abc123",
  "root": "tests/fixtures/pipeline_small_chat",
  "chat_file": "tests/fixtures/pipeline_small_chat/_chat.txt",
  "run_dir": "tests/fixtures/pipeline_small_chat/runs/20241120-103000-abc123",
  "start_time": "2024-11-20T10:30:00Z",
  "end_time": "2024-11-20T10:35:00Z",
  "steps": {
    "M1_parse": {
      "name": "M1_parse",
      "status": "ok",
      "total": 3,
      "done": 3,
      "error": null,
      "started_at": "2024-11-20T10:30:00Z",
      "ended_at": "2024-11-20T10:31:00Z"
    },
    "M2_media": {
      "name": "M2_media",
      "status": "ok",
      "total": 3,
      "done": 3,
      "error": null,
      "started_at": "2024-11-20T10:31:00Z",
      "ended_at": "2024-11-20T10:32:00Z"
    },
    "M3_audio": {
      "name": "M3_audio",
      "status": "ok",
      "total": 3,
      "done": 3,
      "error": null,
      "started_at": "2024-11-20T10:32:00Z",
      "ended_at": "2024-11-20T10:34:00Z"
    },
    "M5_text": {
      "name": "M5_text",
      "status": "ok",
      "total": 3,
      "done": 3,
      "error": null,
      "started_at": "2024-11-20T10:34:00Z",
      "ended_at": "2024-11-20T10:35:00Z"
    }
  },
  "summary": {
    "messages_total": 3,
    "voice_total": 1,
    "error": null,
    "resume_enabled": false
  }
}
